{
  "$schema": "https://json-schema.org/draft/2020-12/schema",
  "$id": "https://schemas.workspai.dev/graph/comparable-surface/v1",
  "title": "WorkspaiGraphComparableSurfaceCandidate",
  "type": "object",
  "additionalProperties": false,
  "required": ["contract", "ontologyId", "kindAliases", "relationAliases"],
  "properties": {
    "contract": {
      "const": {
        "id": "workspai.graph.comparable-surface",
        "version": "1"
      }
    },
    "ontologyId": {
      "const": "workspai.graph.ontology.core"
    },
    "kindAliases": {
      "const": {
        "test-suite": "test",
        "runtime-unit": "runtime",
        "lifecycle-stage": "gate",
        "protocol": "contract",
        "repository": "project"
      }
    },
    "relationAliases": {
      "const": {
        "publishes": "produces",
        "deploys": "deployed-as",
        "documents": "documented-by",
        "owns": "owned-by",
        "generated-by": "produced-by",
        "implements-protocol": "implements"
      }
    }
  }
}
